{
  "$schema": "../schema/asset-manifest.schema.json",
  "schema_version": 2,
  "asset_id": "campus_modular_kit_v004",
  "family": [
    "lab_core",
    "compute",
    "research_talent"
  ],
  "footprint": {
    "width_m": 30.0,
    "depth_m": 11.0,
    "height_m": 8.0
  },
  "location_role": "campus_primary_surface",
  "state_layers": [
    "growth",
    "overload",
    "scrutiny"
  ],
  "lod_policy": {
    "prototype": "lod0_only",
    "next_gate": "author_lod1_after_gameplay_scale_validation"
  },
  "collision_type": "none_render_proof",
  "material_budget": {
    "max_materials": 10,
    "painted_textures": 0
  },
  "source_file": "source/campus_modular_kit.blend",
  "catalog_file": "game/assets/generated/asset_catalog.json",
  "exports": [
    {
      "id": "lab_stage1",
      "collection": "Export__LabStage1",
      "layer": "base",
      "export_file": "game/assets/generated/lab_stage1.glb"
    },
    {
      "id": "compute",
      "collection": "Export__Compute",
      "layer": "base",
      "export_file": "game/assets/generated/compute.glb"
    },
    {
      "id": "research",
      "collection": "Export__Research",
      "layer": "base",
      "export_file": "game/assets/generated/research.glb"
    },
    {
      "id": "growth",
      "collection": "Export__Growth",
      "layer": "growth",
      "export_file": "game/assets/generated/growth.glb"
    },
    {
      "id": "overload",
      "collection": "Export__Overload",
      "layer": "overload",
      "export_file": "game/assets/generated/overload.glb"
    },
    {
      "id": "scrutiny",
      "collection": "Export__Scrutiny",
      "layer": "scrutiny",
      "export_file": "game/assets/generated/scrutiny.glb"
    }
  ],
  "generator": "model-pipeline/scripts/export_assets.py",
  "required_blender": "5.1"
}
